{
  "$schema": "https://json-schema.org/draft/2020-12/schema",
  "$id": "incident.v1",
  "title": "IncidentV1",
  "description": "Incident / near miss / hazard observation (HLD §6.11, §6.15). Syncs as P0.",
  "type": "object",
  "additionalProperties": false,
  "required": [
    "schema",
    "incident_id",
    "type",
    "category",
    "ts",
    "x_m",
    "y_m",
    "machine_id",
    "operator_id",
    "reporter_id",
    "severity_self",
    "photo_paths",
    "status"
  ],
  "properties": {
    "schema": {
      "const": "incident.v1"
    },
    "incident_id": {
      "type": "string",
      "format": "uuid"
    },
    "type": {
      "enum": [
        "NEAR_MISS",
        "INCIDENT",
        "INJURY",
        "EQUIPMENT_DAMAGE",
        "HAZARD_OBSERVATION"
      ]
    },
    "category": {
      "enum": [
        "PERSON_PROXIMITY",
        "SLIP_FALL",
        "ROLLOVER_RISK",
        "POWER_LINE",
        "UTILITY_STRIKE",
        "OTHER"
      ]
    },
    "ts": {
      "type": "string",
      "format": "date-time",
      "pattern": "^\\d{4}-\\d{2}-\\d{2}T\\d{2}:\\d{2}:\\d{2}(\\.\\d+)?(Z|[+-]\\d{2}:\\d{2})$"
    },
    "x_m": {
      "type": [
        "number",
        "null"
      ]
    },
    "y_m": {
      "type": [
        "number",
        "null"
      ]
    },
    "machine_id": {
      "type": [
        "string",
        "null"
      ]
    },
    "operator_id": {
      "type": [
        "string",
        "null"
      ]
    },
    "reporter_id": {
      "type": "string"
    },
    "severity_self": {
      "type": "integer",
      "minimum": 1,
      "maximum": 3
    },
    "voice_note_path": {
      "type": [
        "string",
        "null"
      ]
    },
    "transcript": {
      "type": [
        "string",
        "null"
      ]
    },
    "photo_paths": {
      "type": "array",
      "maxItems": 3,
      "items": {
        "type": "string"
      }
    },
    "state_snapshot": {
      "type": [
        "object",
        "null"
      ],
      "description": "Last 60 s telemetry summary."
    },
    "linked_alert_ids": {
      "type": "array",
      "items": {
        "type": "string",
        "format": "uuid"
      }
    },
    "hazard_pin_id": {
      "type": [
        "string",
        "null"
      ]
    },
    "status": {
      "enum": [
        "OPEN",
        "REVIEWED",
        "CLOSED"
      ]
    },
    "supervisor_notes": {
      "type": [
        "string",
        "null"
      ]
    }
  }
}
